{
  "$schema": "https://json-schema.org/draft/2020-12/schema",
  "$id": "https://kotik-botik/kotik-botik/rules/schema/approval-tokens.schema.json",
  "title": "Approval tokens",
  "description": "Канонический apruv-словарь /builder V-гейтов. Lives в rules/approval-tokens.json. Human-readable вариант — секция «Approval tokens» в .claude/commands/builder.md.",
  "type": "object",
  "required": ["version", "allow_list", "deny_list_pure_numbers", "deny_list_pure_emoji", "deny_list_phrases", "normalization"],
  "additionalProperties": false,
  "properties": {
    "$schema": {
      "type": "string",
      "description": "Schema reference для editor support."
    },
    "_doc": {
      "type": "string",
      "description": "Optional inline documentation."
    },
    "version": {
      "type": "integer",
      "enum": [1],
      "description": "Schema version. Bump (и enum extend) при breaking change."
    },
    "allow_list": {
      "type": "array",
      "minItems": 1,
      "uniqueItems": true,
      "items": {
        "type": "string",
        "minLength": 2
      },
      "description": "Слова/фразы, которые Builder признаёт как apruv-token (после нормализации). Дубликаты запрещены — guard от copy-paste accidents."
    },
    "deny_list_pure_numbers": {
      "type": "boolean",
      "description": "Если true — чистые числа (\"3\", \"1\") не считаются apruv'ом."
    },
    "deny_list_pure_emoji": {
      "type": "boolean",
      "description": "Если true — сообщения, состоящие только из эмодзи (\"👍\"), не считаются apruv'ом."
    },
    "deny_list_phrases": {
      "type": "array",
      "uniqueItems": true,
      "items": {
        "type": "string",
        "minLength": 2
      },
      "description": "Неоднозначные фразы, которые НЕ считаются apruv'ом — Builder должен переспросить. Дубликаты запрещены."
    },
    "normalization": {
      "type": "object",
      "required": ["case_insensitive", "strip_trailing_punctuation", "strip_trailing_whitespace", "emoji_adjacent_ok"],
      "additionalProperties": false,
      "properties": {
        "case_insensitive": { "type": "boolean" },
        "strip_trailing_punctuation": { "type": "boolean" },
        "strip_trailing_whitespace": { "type": "boolean" },
        "emoji_adjacent_ok": {
          "type": "boolean",
          "description": "Если true — эмодзи рядом с apruv-словом не убирает строку из allow-list (\"ок 👍\" — apruv)."
        }
      }
    }
  }
}
